{
  "$schema": "https://opencode.ai/desktop-theme.json",
  "name": "Hackerman",
  "id": "hackerman",
  "darkOnly": true,
  "light": {
    "palette": {
      "neutral": "#000000",
      "ink": "#c9ffd6",
      "primary": "#00ff66",
      "accent": "#00ff66",
      "success": "#00ff66",
      "warning": "#ffd400",
      "error": "#ff3b3b",
      "info": "#00d9ff",
      "interactive": "#00ff66",
      "diffAdd": "#00ff66",
      "diffDelete": "#ff3b3b"
    },
    "overrides": {
      "background-base": "#040a05",
      "background-weak": "#0b160e",
      "background-strong": "#000000",
      "background-stronger": "#0b160e",
      "surface-raised-stronger-non-alpha": "#0b160e",
      "surface-float-base": "#0b160e",
      "input-base": "#0b160e",
      "text-strong": "#c9ffd6",
      "text-base": "#c9ffd6",
      "text-weak": "#6fb283",
      "text-weaker": "#3f7d52",
      "text-interactive-base": "#00ff66",
      "border-base": "#17381f",
      "border-weak-base": "#17381f",
      "border-weaker-base": "#0f2616",
      "border-strong-base": "#2c7a44",
      "icon-base": "#6fb283",
      "icon-weak-base": "#3f7d52",
      "icon-strong-base": "#c9ffd6",
      "markdown-text": "#c9ffd6",
      "markdown-horizontal-rule": "#17381f",
      "surface-diff-add-base": "#06260f",
      "surface-diff-delete-base": "#2b0a0a",
      "syntax-comment": "#4a8a5c",
      "syntax-keyword": "#00e5ff",
      "syntax-string": "#7dff9b",
      "syntax-primitive": "#ffd400",
      "syntax-variable": "#c9ffd6",
      "syntax-property": "#00d9ff",
      "syntax-type": "#ffd400",
      "syntax-constant": "#ff9e3b",
      "syntax-operator": "#00ff66",
      "syntax-punctuation": "#8fbf9b",
      "syntax-object": "#c9ffd6",
      "markdown-heading": "#00ff66",
      "markdown-link": "#00d9ff",
      "markdown-link-text": "#00e5ff",
      "markdown-code": "#7dff9b",
      "markdown-block-quote": "#6fb283",
      "markdown-emph": "#ffd400",
      "markdown-strong": "#c9ffd6",
      "markdown-list-item": "#00ff66",
      "markdown-list-enumeration": "#00e5ff",
      "markdown-code-block": "#c9ffd6"
    },
    "v2Overrides": {
      "v2-background-bg-deep": "#000000",
      "v2-background-bg-base": "#040a05",
      "v2-background-bg-layer-01": "#0b160e",
      "v2-background-bg-layer-02": "#12231a",
      "v2-background-bg-layer-03": "#1a3524",
      "v2-text-text-base": "#c9ffd6",
      "v2-text-text-muted": "#6fb283",
      "v2-text-text-faint": "#3f7d52",
      "v2-text-text-accent": "#00ff66",
      "v2-icon-icon-accent": "#00ff66",
      "v2-background-bg-accent": "#00ff66",
      "v2-border-border-base": "#17381f",
      "v2-border-border-muted": "#0f2616",
      "v2-border-border-strong": "#2c7a44",
      "v2-border-border-focus": "#00ff66"
    }
  },
  "dark": {
    "palette": {
      "neutral": "#000000",
      "ink": "#c9ffd6",
      "primary": "#00ff66",
      "accent": "#00ff66",
      "success": "#00ff66",
      "warning": "#ffd400",
      "error": "#ff3b3b",
      "info": "#00d9ff",
      "interactive": "#00ff66",
      "diffAdd": "#00ff66",
      "diffDelete": "#ff3b3b"
    },
    "overrides": {
      "background-base": "#040a05",
      "background-weak": "#0b160e",
      "background-strong": "#000000",
      "background-stronger": "#0b160e",
      "surface-raised-stronger-non-alpha": "#0b160e",
      "surface-float-base": "#0b160e",
      "input-base": "#0b160e",
      "text-strong": "#c9ffd6",
      "text-base": "#c9ffd6",
      "text-weak": "#6fb283",
      "text-weaker": "#3f7d52",
      "text-interactive-base": "#00ff66",
      "border-base": "#17381f",
      "border-weak-base": "#17381f",
      "border-weaker-base": "#0f2616",
      "border-strong-base": "#2c7a44",
      "icon-base": "#6fb283",
      "icon-weak-base": "#3f7d52",
      "icon-strong-base": "#c9ffd6",
      "markdown-text": "#c9ffd6",
      "markdown-horizontal-rule": "#17381f",
      "surface-diff-add-base": "#06260f",
      "surface-diff-delete-base": "#2b0a0a",
      "syntax-comment": "#4a8a5c",
      "syntax-keyword": "#00e5ff",
      "syntax-string": "#7dff9b",
      "syntax-primitive": "#ffd400",
      "syntax-variable": "#c9ffd6",
      "syntax-property": "#00d9ff",
      "syntax-type": "#ffd400",
      "syntax-constant": "#ff9e3b",
      "syntax-operator": "#00ff66",
      "syntax-punctuation": "#8fbf9b",
      "syntax-object": "#c9ffd6",
      "markdown-heading": "#00ff66",
      "markdown-link": "#00d9ff",
      "markdown-link-text": "#00e5ff",
      "markdown-code": "#7dff9b",
      "markdown-block-quote": "#6fb283",
      "markdown-emph": "#ffd400",
      "markdown-strong": "#c9ffd6",
      "markdown-list-item": "#00ff66",
      "markdown-list-enumeration": "#00e5ff",
      "markdown-code-block": "#c9ffd6"
    },
    "v2Overrides": {
      "v2-background-bg-deep": "#000000",
      "v2-background-bg-base": "#040a05",
      "v2-background-bg-layer-01": "#0b160e",
      "v2-background-bg-layer-02": "#12231a",
      "v2-background-bg-layer-03": "#1a3524",
      "v2-text-text-base": "#c9ffd6",
      "v2-text-text-muted": "#6fb283",
      "v2-text-text-faint": "#3f7d52",
      "v2-text-text-accent": "#00ff66",
      "v2-icon-icon-accent": "#00ff66",
      "v2-background-bg-accent": "#00ff66",
      "v2-border-border-base": "#17381f",
      "v2-border-border-muted": "#0f2616",
      "v2-border-border-strong": "#2c7a44",
      "v2-border-border-focus": "#00ff66"
    }
  },
  "skin": {
    "font": "mono"
  }
}
