{
  "$schema": "https://opencode.ai/desktop-theme.json",
  "name": "Claude",
  "id": "claude",
  "light": {
    "palette": {
      "neutral": "#faf9f5",
      "ink": "#2b2926",
      "primary": "#c6613f",
      "accent": "#b9532f",
      "success": "#4f7d3c",
      "warning": "#b7791f",
      "error": "#b3382c",
      "info": "#3d6f8f",
      "interactive": "#c6613f",
      "diffAdd": "#5f8f4a",
      "diffDelete": "#c4524a"
    },
    "overrides": {
      "background-base": "#faf9f5",
      "background-weak": "#efede4",
      "background-strong": "#f0eee6",
      "background-stronger": "#efede4",
      "surface-raised-stronger-non-alpha": "#efede4",
      "surface-float-base": "#efede4",
      "input-base": "#efede4",
      "text-strong": "#2b2926",
      "text-base": "#2b2926",
      "text-weak": "#6b675d",
      "text-weaker": "#857f72",
      "text-interactive-base": "#b9532f",
      "border-base": "#e3dfd3",
      "border-weak-base": "#e3dfd3",
      "border-weaker-base": "#ece9df",
      "border-strong-base": "#c9c4b4",
      "icon-base": "#6b675d",
      "icon-weak-base": "#857f72",
      "icon-strong-base": "#2b2926",
      "markdown-text": "#2b2926",
      "markdown-horizontal-rule": "#e3dfd3",
      "surface-diff-add-base": "#e1ecd6",
      "surface-diff-delete-base": "#f4dad5",
      "syntax-comment": "#857f72",
      "syntax-keyword": "#a8452a",
      "syntax-string": "#4f7d3c",
      "syntax-primitive": "#3d6f8f",
      "syntax-property": "#3d6f8f",
      "syntax-constant": "#b7791f",
      "markdown-heading": "#b9532f",
      "markdown-link": "#a8452a"
    },
    "v2Overrides": {
      "v2-background-bg-deep": "#f0eee6",
      "v2-background-bg-base": "#faf9f5",
      "v2-background-bg-layer-01": "#efede4",
      "v2-background-bg-layer-02": "#e6e3d8",
      "v2-background-bg-layer-03": "#d9d5c7",
      "v2-text-text-base": "#2b2926",
      "v2-text-text-muted": "#6b675d",
      "v2-text-text-faint": "#857f72",
      "v2-text-text-accent": "#b9532f",
      "v2-icon-icon-accent": "#c6613f",
      "v2-background-bg-accent": "#c6613f",
      "v2-border-border-base": "#e3dfd3",
      "v2-border-border-muted": "#ece9df",
      "v2-border-border-strong": "#c9c4b4",
      "v2-border-border-focus": "#c6613f"
    }
  },
  "dark": {
    "palette": {
      "neutral": "#1f1e1d",
      "ink": "#f2f0e8",
      "primary": "#d97757",
      "accent": "#d97757",
      "success": "#8fb573",
      "warning": "#e0b255",
      "error": "#e5736a",
      "info": "#7fb0cf",
      "interactive": "#d97757",
      "diffAdd": "#8fb573",
      "diffDelete": "#e5736a"
    },
    "overrides": {
      "background-base": "#262624",
      "background-weak": "#2f2e2b",
      "background-strong": "#1a1918",
      "background-stronger": "#2f2e2b",
      "surface-raised-stronger-non-alpha": "#2f2e2b",
      "surface-float-base": "#2f2e2b",
      "input-base": "#2f2e2b",
      "text-strong": "#f2f0e8",
      "text-base": "#f2f0e8",
      "text-weak": "#b0aea5",
      "text-weaker": "#7d7b73",
      "text-interactive-base": "#e08a6b",
      "border-base": "#3d3d3a",
      "border-weak-base": "#3d3d3a",
      "border-weaker-base": "#32312e",
      "border-strong-base": "#5a5852",
      "icon-base": "#b0aea5",
      "icon-weak-base": "#7d7b73",
      "icon-strong-base": "#f2f0e8",
      "markdown-text": "#f2f0e8",
      "markdown-horizontal-rule": "#3d3d3a",
      "surface-diff-add-base": "#27331f",
      "surface-diff-delete-base": "#3b2220",
      "syntax-comment": "#7d7b73",
      "syntax-keyword": "#e08a6b",
      "syntax-string": "#8fb573",
      "syntax-primitive": "#7fb0cf",
      "syntax-property": "#7fb0cf",
      "syntax-constant": "#e0b255",
      "markdown-heading": "#e08a6b",
      "markdown-link": "#e08a6b"
    },
    "v2Overrides": {
      "v2-background-bg-deep": "#1a1918",
      "v2-background-bg-base": "#262624",
      "v2-background-bg-layer-01": "#2f2e2b",
      "v2-background-bg-layer-02": "#3a3935",
      "v2-background-bg-layer-03": "#4a4842",
      "v2-text-text-base": "#f2f0e8",
      "v2-text-text-muted": "#b0aea5",
      "v2-text-text-faint": "#7d7b73",
      "v2-text-text-accent": "#e08a6b",
      "v2-icon-icon-accent": "#d97757",
      "v2-background-bg-accent": "#d97757",
      "v2-border-border-base": "#3d3d3a",
      "v2-border-border-muted": "#32312e",
      "v2-border-border-strong": "#5a5852",
      "v2-border-border-focus": "#d97757"
    }
  }
}
